{
  "id": "claim-breadcrumbs-deep-hierarchy",
  "schema_version": 1,
  "claim": {
    "statement": "Provide breadcrumb navigation on sites with deep hierarchies to support wayfinding and let users move up to parent categories at low UI cost.",
    "category": "navigation-and-ia",
    "type": "recommendation",
    "force": "strong-recommendation"
  },
  "applicability": {
    "product_forms": [
      "website",
      "ecommerce",
      "documentation",
      "public-service-system",
      "web-app",
      "enterprise-app"
    ],
    "purposes": [
      "browse",
      "navigate",
      "learn"
    ],
    "workflows": [
      "search-and-filter",
      "daily-operation"
    ],
    "expertise": [
      "mixed"
    ],
    "abilities": [
      "cognitive",
      "none-specified"
    ],
    "risks": [
      "low"
    ],
    "devices": [
      "desktop",
      "touch",
      "mobile"
    ],
    "environments": [
      "office",
      "home"
    ],
    "audience_roles": [
      "beneficiary",
      "observer"
    ]
  },
  "evidence": {
    "tier": 3,
    "sources": [
      "src-nngroup"
    ],
    "methodology": [
      "moderated-usability-testing",
      "heuristic-evaluation"
    ],
    "confidence": "high",
    "limitations": [
      "Greatest benefit on multi-level hierarchies; breadcrumbs add little on flat sites."
    ]
  },
  "recommendation": {
    "do": [
      "Show the hierarchy path to the current page",
      "Make each ancestor a working link"
    ],
    "avoid": [
      "Breadcrumbs on a one- or two-level site where they add noise"
    ]
  },
  "detection": {
    "static": false,
    "browser": true,
    "model_review": true,
    "human": true
  },
  "validation": {
    "methods": [
      "usability-testing",
      "expert-review"
    ],
    "automatable": "partial",
    "requires_human_eval": true,
    "metrics": [
      "task-completion-rate",
      "error-rate"
    ]
  },
  "legal": {
    "compliance_claim_allowed": false,
    "disclaimer_required": true
  },
  "freshness": {
    "published_at": "2018-09-30",
    "reviewed_at": "2026-06-28",
    "review_after": "2027-06-28",
    "status": "current"
  }
}
